{
  "videoSlug": "why-the-roman-empire-really-collapsed",
  "sourceFile": "04-scenes-final.json",
  "timingMode": "transcript-guided-alignment",
  "cues": [
    {
      "index": 1,
      "sceneNumber": 1,
      "startTime": 0.0,
      "endTime": 1.751,
      "lines": [
        "September, 476 AD."
      ]
    },
    {
      "index": 2,
      "sceneNumber": 1,
      "startTime": 1.751,
      "endTime": 4.085,
      "lines": [
        "The Roman Empire falls."
      ]
    },
    {
      "index": 3,
      "sceneNumber": 1,
      "startTime": 4.085,
      "endTime": 6.82,
      "lines": [
        "And almost nobody notices."
      ]
    },
    {
      "index": 4,
      "sceneNumber": 2,
      "startTime": 6.82,
      "endTime": 9.02,
      "lines": [
        "No burning city. No final battle."
      ]
    },
    {
      "index": 5,
      "sceneNumber": 2,
      "startTime": 9.02,
      "endTime": 12.52,
      "lines": [
        "Just a boy emperor,",
        "quietly told to go home."
      ]
    },
    {
      "index": 6,
      "sceneNumber": 3,
      "startTime": 12.52,
      "endTime": 14.788,
      "lines": [
        "Because the empire didn't die that day."
      ]
    },
    {
      "index": 7,
      "sceneNumber": 3,
      "startTime": 14.788,
      "endTime": 17.54,
      "lines": [
        "It had been dying for three hundred years."
      ]
    },
    {
      "index": 8,
      "sceneNumber": 4,
      "startTime": 17.54,
      "endTime": 19.873,
      "lines": [
        "This is the real story of how"
      ]
    },
    {
      "index": 9,
      "sceneNumber": 4,
      "startTime": 19.873,
      "endTime": 22.94,
      "lines": [
        "Rome collapsed, and why",
        "everyone remembers it wrong."
      ]
    },
    {
      "index": 10,
      "sceneNumber": 5,
      "startTime": 23.38,
      "endTime": 26.54,
      "lines": [
        "Picture the empire everyone",
        "imagines: endless legions,"
      ]
    },
    {
      "index": 11,
      "sceneNumber": 5,
      "startTime": 26.54,
      "endTime": 30.0,
      "lines": [
        "marble cities, roads that ruled the world."
      ]
    },
    {
      "index": 12,
      "sceneNumber": 6,
      "startTime": 30.0,
      "endTime": 32.019,
      "lines": [
        "But an empire isn't marble."
      ]
    },
    {
      "index": 13,
      "sceneNumber": 6,
      "startTime": 32.019,
      "endTime": 34.038,
      "lines": [
        "It's a machine: an army,"
      ]
    },
    {
      "index": 14,
      "sceneNumber": 6,
      "startTime": 34.038,
      "endTime": 36.86,
      "lines": [
        "paid by taxes, paid in silver."
      ]
    },
    {
      "index": 15,
      "sceneNumber": 7,
      "startTime": 36.94,
      "endTime": 39.211,
      "lines": [
        "That army numbered somewhere between four"
      ]
    },
    {
      "index": 16,
      "sceneNumber": 7,
      "startTime": 39.211,
      "endTime": 42.26,
      "lines": [
        "hundred thousand and six",
        "hundred thousand men."
      ]
    },
    {
      "index": 17,
      "sceneNumber": 8,
      "startTime": 42.58,
      "endTime": 46.1,
      "lines": [
        "Soldiers expected pay and",
        "supplies, every single year."
      ]
    },
    {
      "index": 18,
      "sceneNumber": 8,
      "startTime": 46.1,
      "endTime": 49.58,
      "lines": [
        "Multiply that by half a million men."
      ]
    },
    {
      "index": 19,
      "sceneNumber": 9,
      "startTime": 49.9,
      "endTime": 52.9,
      "lines": [
        "It was the single biggest",
        "expense the Roman state had."
      ]
    },
    {
      "index": 20,
      "sceneNumber": 9,
      "startTime": 52.9,
      "endTime": 54.8,
      "lines": [
        "And the bill kept growing."
      ]
    },
    {
      "index": 21,
      "sceneNumber": 10,
      "startTime": 55.24,
      "endTime": 58.54,
      "lines": [
        "Break the machine that pays",
        "that army, and you break Rome."
      ]
    },
    {
      "index": 22,
      "sceneNumber": 10,
      "startTime": 58.54,
      "endTime": 59.86,
      "lines": [
        "So let's break it."
      ]
    },
    {
      "index": 23,
      "sceneNumber": 11,
      "startTime": 59.86,
      "endTime": 61.66,
      "lines": [
        "Start in the year 235."
      ]
    },
    {
      "index": 24,
      "sceneNumber": 11,
      "startTime": 61.66,
      "endTime": 63.82,
      "lines": [
        "Over the next fifty years, Rome"
      ]
    },
    {
      "index": 25,
      "sceneNumber": 11,
      "startTime": 63.82,
      "endTime": 66.18,
      "lines": [
        "burned through at least",
        "twenty-six emperors."
      ]
    },
    {
      "index": 26,
      "sceneNumber": 12,
      "startTime": 66.18,
      "endTime": 67.998,
      "lines": [
        "Twenty-six men in fifty years."
      ]
    },
    {
      "index": 27,
      "sceneNumber": 12,
      "startTime": 67.998,
      "endTime": 70.542,
      "lines": [
        "The throne had stopped being a prize."
      ]
    },
    {
      "index": 28,
      "sceneNumber": 12,
      "startTime": 70.542,
      "endTime": 72.66,
      "lines": [
        "It was a death sentence."
      ]
    },
    {
      "index": 29,
      "sceneNumber": 13,
      "startTime": 72.66,
      "endTime": 75.73,
      "lines": [
        "Every general with an",
        "army could crown himself."
      ]
    },
    {
      "index": 30,
      "sceneNumber": 13,
      "startTime": 75.73,
      "endTime": 78.8,
      "lines": [
        "So every general did.",
        "Civil war became routine."
      ]
    },
    {
      "index": 31,
      "sceneNumber": 14,
      "startTime": 78.8,
      "endTime": 81.78,
      "lines": [
        "And while Romans fought",
        "Romans, the borders"
      ]
    },
    {
      "index": 32,
      "sceneNumber": 14,
      "startTime": 81.78,
      "endTime": 85.08,
      "lines": [
        "went unguarded, and the treasury bled dry."
      ]
    },
    {
      "index": 33,
      "sceneNumber": 15,
      "startTime": 85.08,
      "endTime": 87.278,
      "lines": [
        "Which brings us to the silver."
      ]
    },
    {
      "index": 34,
      "sceneNumber": 15,
      "startTime": 87.278,
      "endTime": 91.34,
      "lines": [
        "Watch the silver, because this",
        "is where empires really die."
      ]
    },
    {
      "index": 35,
      "sceneNumber": 16,
      "startTime": 91.76,
      "endTime": 94.252,
      "lines": [
        "Rome's standard coin, the denarius, was"
      ]
    },
    {
      "index": 36,
      "sceneNumber": 16,
      "startTime": 94.252,
      "endTime": 97.56,
      "lines": [
        "once more than ninety percent pure silver."
      ]
    },
    {
      "index": 37,
      "sceneNumber": 17,
      "startTime": 97.88,
      "endTime": 100.29,
      "lines": [
        "Each time an emperor ran short of cash,"
      ]
    },
    {
      "index": 38,
      "sceneNumber": 17,
      "startTime": 100.29,
      "endTime": 103.1,
      "lines": [
        "he melted the coins and added cheap metal."
      ]
    },
    {
      "index": 39,
      "sceneNumber": 18,
      "startTime": 103.34,
      "endTime": 105.473,
      "lines": [
        "By the 270s, the denarius"
      ]
    },
    {
      "index": 40,
      "sceneNumber": 18,
      "startTime": 105.473,
      "endTime": 107.607,
      "lines": [
        "was around five percent silver."
      ]
    },
    {
      "index": 41,
      "sceneNumber": 18,
      "startTime": 107.607,
      "endTime": 110.14,
      "lines": [
        "A shiny coating over junk."
      ]
    },
    {
      "index": 42,
      "sceneNumber": 19,
      "startTime": 110.22,
      "endTime": 112.553,
      "lines": [
        "Imagine getting paid in coins that lose"
      ]
    },
    {
      "index": 43,
      "sceneNumber": 19,
      "startTime": 112.553,
      "endTime": 115.6,
      "lines": [
        "their value faster than",
        "you can spend them."
      ]
    },
    {
      "index": 44,
      "sceneNumber": 20,
      "startTime": 115.6,
      "endTime": 117.688,
      "lines": [
        "Prices exploded across the empire."
      ]
    },
    {
      "index": 45,
      "sceneNumber": 20,
      "startTime": 117.688,
      "endTime": 119.775,
      "lines": [
        "When money itself stops being"
      ]
    },
    {
      "index": 46,
      "sceneNumber": 20,
      "startTime": 119.775,
      "endTime": 122.68,
      "lines": [
        "trusted, everything built on it wobbles."
      ]
    },
    {
      "index": 47,
      "sceneNumber": 21,
      "startTime": 123.08,
      "endTime": 126.848,
      "lines": [
        "Emperor Diocletian tried to",
        "fix inflation by outlawing it."
      ]
    },
    {
      "index": 48,
      "sceneNumber": 21,
      "startTime": 126.848,
      "endTime": 129.48,
      "lines": [
        "High prices became a capital crime."
      ]
    },
    {
      "index": 49,
      "sceneNumber": 22,
      "startTime": 129.48,
      "endTime": 130.929,
      "lines": [
        "It failed spectacularly."
      ]
    },
    {
      "index": 50,
      "sceneNumber": 22,
      "startTime": 130.929,
      "endTime": 133.343,
      "lines": [
        "Merchants stopped selling, and goods"
      ]
    },
    {
      "index": 51,
      "sceneNumber": 22,
      "startTime": 133.343,
      "endTime": 136.64,
      "lines": [
        "simply vanished into the black market."
      ]
    },
    {
      "index": 52,
      "sceneNumber": 23,
      "startTime": 136.84,
      "endTime": 140.68,
      "lines": [
        "Then came the part nobody",
        "could control: disease."
      ]
    },
    {
      "index": 53,
      "sceneNumber": 24,
      "startTime": 141.12,
      "endTime": 143.8,
      "lines": [
        "Two great plagues swept",
        "the empire, emptying"
      ]
    },
    {
      "index": 54,
      "sceneNumber": 24,
      "startTime": 143.8,